{
  "meta": {
    "id": 15,
    "period": 3,
    "date": "2013-12-25"
  },
  "origin": {
    "company": "YourCompany",
    "lawform": "Ltd.",
    "address": "Your Street 13b",
    "postalcode": "0987KJ",
    "town": "Yourtown",
    "country": "Your Country",
    "email": "contact@mycompany.com",
    "website": "mycompany.com",
    "iban": "NL12 ABCD 1234 1234 12",
    "bank": "Triodos Bank",
    "bic": "RABONL2U",
    "kvk": "123456789",
    "vat": "AB1233405923489"
  },
  "validityPeriod": 14,
  "vatPercentage": 0.21,
  "currencySymbol": "â‚¬",
  "client": {
    "organization": "Client Company Name",
    "contactPerson": "Client Contactperson Name",
    "address": "Client Street 11a",
    "postalcode": "6543TR",
    "town": "Client Town",
    "country": "Netherlands, The"
  },
  "projectName": "Optional project name which will be placed on top of table",
  "invoiceItems": [
    {
      "description": "Service string",
      "quantity": 1,
      "price": 203.23
    }, {
      "description": "Product string",
      "quantity": 14,
      "price": 10,
      "discount": 0.1
    }
  ]
}